{
  "evidence_id": "ALPHA-INCIDENT:v2:review",
  "document_id": "ALPHA-INCIDENT",
  "version": "2",
  "section": "review",
  "content_sha256": "62a90906c7bb706ae8a968eb0f7102f76b05d2c3be911c182d528a1fd25ef008",
  "excerpt": "Repeated simulated warnings may be summarized in a reviewable incident draft. A different authorized reviewer must inspect the exact content before submission. The warning count alone does not establish root cause.",
  "effective_from": "2026-10-01T00:00:00Z",
  "retrieved_at": "2026-10-06T12:00:00Z"
}
